{
  "$schema": "https://json-schema.org/draft/2020-12/schema",
  "$id": "https://schemas.coredrill.local/portable-archive-manifest/v1.json",
  "type": "object",
  "properties": {
    "specVersion": { "type": "number", "const": 1 },
    "archiveId": {
      "type": "string",
      "pattern": "^[0-9a-f]{8}-[0-9a-f]{4}-7[0-9a-f]{3}-[89ab][0-9a-f]{3}-[0-9a-f]{12}$"
    },
    "createdAt": {
      "type": "string",
      "format": "date-time",
      "pattern": "^(?:(?:\\d\\d[2468][048]|\\d\\d[13579][26]|\\d\\d0[48]|[02468][048]00|[13579][26]00)-02-29|\\d{4}-(?:(?:0[13578]|1[02])-(?:0[1-9]|[12]\\d|3[01])|(?:0[469]|11)-(?:0[1-9]|[12]\\d|30)|(?:02)-(?:0[1-9]|1\\d|2[0-8])))T(?:(?:[01]\\d|2[0-3]):[0-5]\\d:[0-5]\\d\\.\\d{3}(?:Z))$"
    },
    "createdBy": {
      "type": "object",
      "properties": {
        "name": { "type": "string", "const": "coredrill" },
        "version": {
          "type": "string",
          "maxLength": 64,
          "pattern": "^\\d+\\.\\d+\\.\\d+(?:-[0-9A-Za-z.-]+)?$"
        }
      },
      "required": ["name", "version"],
      "additionalProperties": false
    },
    "vault": {
      "type": "object",
      "properties": {
        "id": {
          "type": "string",
          "pattern": "^[0-9a-f]{8}-[0-9a-f]{4}-7[0-9a-f]{3}-[89ab][0-9a-f]{3}-[0-9a-f]{12}$"
        },
        "schemaVersion": { "type": "integer", "minimum": 0, "maximum": 9007199254740991 },
        "migrationHistory": {
          "maxItems": 10000,
          "type": "array",
          "items": {
            "type": "object",
            "properties": {
              "version": { "type": "integer", "exclusiveMinimum": 0, "maximum": 9007199254740991 },
              "name": {
                "type": "string",
                "maxLength": 128,
                "pattern": "^[a-z][a-z0-9]*(?:[._-][a-z0-9]+)*$"
              },
              "appliedAt": {
                "type": "string",
                "format": "date-time",
                "pattern": "^(?:(?:\\d\\d[2468][048]|\\d\\d[13579][26]|\\d\\d0[48]|[02468][048]00|[13579][26]00)-02-29|\\d{4}-(?:(?:0[13578]|1[02])-(?:0[1-9]|[12]\\d|3[01])|(?:0[469]|11)-(?:0[1-9]|[12]\\d|30)|(?:02)-(?:0[1-9]|1\\d|2[0-8])))T(?:(?:[01]\\d|2[0-3]):[0-5]\\d:[0-5]\\d\\.\\d{3}(?:Z))$"
              },
              "sha256": { "type": "string", "pattern": "^[0-9a-f]{64}$" }
            },
            "required": ["version", "name", "appliedAt", "sha256"],
            "additionalProperties": false
          }
        }
      },
      "required": ["id", "schemaVersion", "migrationHistory"],
      "additionalProperties": false
    },
    "checksumAlgorithm": { "type": "string", "const": "sha256" },
    "database": {
      "type": "object",
      "properties": {
        "path": { "type": "string", "const": "database.sqlite3" },
        "mediaType": { "type": "string", "const": "application/vnd.sqlite3" },
        "byteLength": { "type": "integer", "minimum": 0, "maximum": 9007199254740991 },
        "sha256": { "type": "string", "pattern": "^[0-9a-f]{64}$" },
        "kind": { "type": "string", "const": "database" }
      },
      "required": ["path", "mediaType", "byteLength", "sha256", "kind"],
      "additionalProperties": false
    },
    "dataFiles": {
      "maxItems": 128,
      "type": "array",
      "items": {
        "type": "object",
        "properties": {
          "path": {
            "type": "string",
            "maxLength": 1024,
            "pattern": "^[A-Za-z0-9][A-Za-z0-9._-]*(?:\\/[A-Za-z0-9][A-Za-z0-9._-]*)*$"
          },
          "mediaType": {
            "type": "string",
            "maxLength": 255,
            "pattern": "^[a-z0-9][a-z0-9!#$&^_.+-]*\\/[a-z0-9][a-z0-9!#$&^_.+-]*$"
          },
          "byteLength": { "type": "integer", "minimum": 0, "maximum": 9007199254740991 },
          "sha256": { "type": "string", "pattern": "^[0-9a-f]{64}$" },
          "kind": { "type": "string", "const": "data" },
          "format": { "type": "string", "enum": ["json", "csv"] },
          "logicalName": {
            "type": "string",
            "maxLength": 128,
            "pattern": "^[a-z][a-z0-9]*(?:[._-][a-z0-9]+)*$"
          }
        },
        "required": ["path", "mediaType", "byteLength", "sha256", "kind", "format", "logicalName"],
        "additionalProperties": false
      }
    },
    "attachments": {
      "maxItems": 10000,
      "type": "array",
      "items": {
        "type": "object",
        "properties": {
          "path": {
            "type": "string",
            "maxLength": 1024,
            "pattern": "^[A-Za-z0-9][A-Za-z0-9._-]*(?:\\/[A-Za-z0-9][A-Za-z0-9._-]*)*$"
          },
          "mediaType": {
            "type": "string",
            "maxLength": 255,
            "pattern": "^[a-z0-9][a-z0-9!#$&^_.+-]*\\/[a-z0-9][a-z0-9!#$&^_.+-]*$"
          },
          "byteLength": { "type": "integer", "minimum": 0, "maximum": 9007199254740991 },
          "sha256": { "type": "string", "pattern": "^[0-9a-f]{64}$" },
          "kind": { "type": "string", "const": "attachment" },
          "contentId": { "type": "string", "pattern": "^[0-9a-f]{64}$" },
          "logicalName": { "type": "string", "minLength": 1, "maxLength": 255 }
        },
        "required": ["path", "mediaType", "byteLength", "sha256", "kind", "contentId"],
        "additionalProperties": false
      }
    },
    "encryption": {
      "type": "object",
      "properties": {
        "specVersion": { "type": "number", "const": 1 },
        "mode": { "type": "string", "const": "none" }
      },
      "required": ["specVersion", "mode"],
      "additionalProperties": false
    }
  },
  "required": [
    "specVersion",
    "archiveId",
    "createdAt",
    "createdBy",
    "vault",
    "checksumAlgorithm",
    "database",
    "dataFiles",
    "attachments",
    "encryption"
  ],
  "additionalProperties": false,
  "title": "Coredrill PortableArchiveManifestV1",
  "description": "Checksummed inventory for a portable local vault archive containing its database, human-readable data, attachments, migration history, and explicit encryption state."
}
